[
  {
    "id": "alice",
    "name": "Alice",
    "avatar_url": "https://example.com/alice.png",
    "custom_data": {
      "foo": "bar"
    },
    "created_at": "2020-03-25T10:52:07Z",
    "updated_at": "2020-03-26T15:59:50Z"
  },
  {
    "id": "bob",
    "name": "Bob",
    "created_at": "2020-03-25T10:52:15Z",
    "updated_at": "2020-03-25T10:52:15Z"
  },
  {
    "id": "carol",
    "name": "Carol",
    "created_at": "2020-03-25T10:52:59Z",
    "updated_at": "2020-03-25T10:52:59Z"
  }
]